Investment trust name,Listed,SDR,yfinance_ticker
abrdn Global Sustainable Equity Fund,,SDR Labelled,0P00000VCP.L
abrdn UK Sustainable Equity Fund,,SDR Labelled,0P0000XON0.L
Aegon Sustainable Diversified Growth Fund,,SDR Labelled,0P0000PUD3.L
Aegon Sustainable Equity Fund,,SDR Labelled,0P0001CJ32.L
AEW UK Impact Fund,,SDR Labelled,0P0001HAI6.L
Aquila Energy Efficiency Trust,Listed,,AEET.L
Aquila European Renewables,Listed,,AERI.L
ARC TIME Social Impact Property Fund,,SDR Labelled,0P0001H7ML.L
AXA Carbon Transition Global Short Duration Bond Fund,,SDR Labelled,0P0001SAIS.L
AXA Carbon Transition Sterling Buy and Maintain Credit Fund,,SDR Labelled,0P00011S28.L
,,,
AXA Global Sustainable Managed Fund,,SDR Labelled,0P0000XNBV.L
AXA People & Planet Equity Fund,,SDR Labelled,0P0000XMRV.L
AXA UK Sustainable Equity Fund,,SDR Labelled,0P0000XNC0.L
Baillie Gifford Positive Change Fund,,SDR Labelled,
Baillie Gifford Sustainable Growth Fund,,SDR Labelled,
BFM Brown to Green Materials Fund (BlackRock),,SDR Labelled,
Bluefield Solar Income Fund,Listed,,BSIF.L
CT Responsible Global Equity Fund,,SDR Labelled,
CT Sustainable Global Equity Income Fund,,SDR Labelled,
CT Sustainable Opportunities Global Equity Fund,,SDR Labelled,
CT Sustainable Universal MAP Adventurous Fund,,SDR Labelled,
CT Sustainable Universal MAP Balanced Fund,,,
CT Sustainable Universal MAP Cautious Fund,,SDR Labelled,
CT Sustainable Universal MAP Defensive Fund,,SDR Labelled,
CT Sustainable Universal MAP Growth Fund,,SDR Labelled,
CT UK Sustainable Equity Fund,,SDR Labelled,
Downing Renewables & Infrastructure,Listed,,DORE.L
Ecofin US Renewables Infrastructure,Listed,,DORE.L
EdenTree Global Impact Bond Fund,,SDR Labelled,
EdenTree Global Select Government Bond Fund,,SDR Labelled,
EdenTree Global Sustainable Government Bond Fund,,SDR Labelled,
Edentree Green Future Fund,,SDR Labelled,
EdenTree Green Infrastructure Fund,,SDR Labelled,
Fidelity Sustainable European Equity Fund,,SDR Labelled,
Fidelity Sustainable Global Equity Fund,,SDR Labelled,
Fidelity Sustainable Multi-Asset Balanced Fund,,SDR Labelled,
Fidelity Sustainable Multi-Asset Conservative Fund,,SDR Labelled,
Fidelity Sustainable Multi-Asset Growth Fund,,SDR Labelled,
Fidelity Sustainable UK Equity Fund,,SDR Labelled,
Foresight Environmental Infrastructure,Listed,,FGEN.L
Foresight Solar Fund,Listed,,FSFL.L
FP Foresight Global Real Infrastructure Fund,,SDR Labelled,
FP Foresight Sustainable Future Themes Fund,,SDR Labelled,
FP Foresight Sustainable Real Estate Securities Fund,,SDR Labelled,
FP Foresight UK Infrastructure Income Fund,,SDR Labelled,
FP WHEB Sustainability Impact Fund,,SDR Labelled,
Global Impact Credit Fund,,SDR Labelled,
Global Impact Equity Fund,,SDR Labelled,
Gore Street Energy Storage Fund,Listed,SDR Labelled,GSF.L
Greencoat Renewables,Listed,,GRP.IR
Greencoat UK Wind,Listed,SDR Labelled,UKW.L
Gresham House Energy Storage,Listed,,GRID.L
HydrogenOne Capital Growth,Listed,,HGEN.L
Impax Environmental Markets,Listed,SDR Labelled,IEM.L
Janus Henderson Global Sustainable Equity Fund,,SDR Labelled,
Janus Henderson Sustainable Future Technologies Fund,,SDR Labelled,
Janus Henderson US Sustainable Equity Fund,,SDR Labelled,
Jupiter Ecology Fund,,SDR Labelled,
Jupiter Responsible Income Fund,,SDR Labelled,
Liontrust Sustainable Future Cautious Managed Fund,,SDR Labelled,
Liontrust Sustainable Future Corporate Bond,,SDR Labelled,
Liontrust Sustainable Future Defensive Managed Fund,,SDR Labelled,
Liontrust Sustainable Future European Growth Fund,,SDR Labelled,
Liontrust Sustainable Future Global Growth Fund,,SDR Labelled,
Liontrust Sustainable Future Managed Fund,,SDR Labelled,
Liontrust Sustainable Future Managed Growth Fund,,SDR Labelled,
Liontrust Sustainable Future Monthly Income Bond Fund,,SDR Labelled,
Liontrust Sustainable Future UK Growth Fund,,SDR Labelled,
Liontrust UK Ethical Fund,,SDR Labelled,
M&G European Sustain Paris Aligned Fund,,SDR Labelled,
M&G Global Sustain Paris Aligned Fund,,SDR Labelled,
M&G Positive Impact Fund,,SDR Labelled,
M&G UK Sustain Paris Aligned Fund,,SDR Labelled,
NextEnergy Solar Fund,Listed,,NESF.L
Ninety One Funds Series III - Global Environment Fund,,SDR Labelled,
Ninety One Funds Series III - Global Equity,,SDR Labelled,
Ninety One Funds Series iii - Global Sustainable Equity Fund,,SDR Labelled,
NS&I Green Savings Bonds,,SDR Labelled,
Octopus Renewables Infrastructure Trust,Listed,,ORIT.L
Premier Miton Emerging Markets Sustainable Fund,,SDR Labelled,
Premier Miton Global Sustainable Growth Fund,,SDR Labelled,
Premier Miton Global Sustainable Optimum Income Fund,,SDR Labelled,
Rathbone Greenbank Defensive Return,,SDR Labelled,
Rathbone Greenbank Global Sustainability Fund,,SDR Labelled,
Rathbone Greenbank Global Sustainable Bond Fund,,SDR Labelled,
Rathbone Greenbank Strategic Growth,,SDR Labelled,
Rathbone Greenbank Total Return,,SDR Labelled,
Rathebone Greenbank Dynamic Growth,,SDR Labelled,
Regnan Global Equity Impact Solutions Fund,,SDR Labelled,
Regnan Sustainable Water and Waste,,SDR Labelled,
Renewables Infrastructure Group,Listed,,TRIG.L
Schroder BSC Social Impact Trust,Listed,SDR Labelled,SBSI.L
Schroder European Climate Transition Fund,,SDR Labelled,
Schroder Global Alternative Energy Fund,,SDR Labelled,
Schroder Global Cities Real Estate Fund,,SDR Labelled,
Schroder Global Sustainable Food and Water Fund,,SDR Labelled,
Schroder Global Sustainable Growth Fund,,SDR Labelled,
Schroder Global Sustainable Value Equity Fund,,SDR Labelled,
Schroder Sustainable Bond Fund,,SDR Labelled,
Schroder Sustainable Future Multi-Asset Fund,,SDR Labelled,
Schroder Sustainable Multi-Factor Equity Fund,,SDR Labelled,
Schroder Sustainable UK Equity Fund,,SDR Labelled,
Schroder SUTL Cazenove Sustainable Growth Fund,,SDR Labelled,
Schroders Capital Real Estate Impact Fund (SCREIF),,SDR Labelled,
SDCL Efficiency Income,Listed,,SEIT.L
SJP Sustainable & Responsible Equity Fund,,SDR Labelled,
Standard Life Future Advantage (1-5) Pension range,,SDR Labelled,
SUTL Cazenove Charity Sustainable Multi-Asset Fund,,SDR Labelled,
SUTL Cazenove Sustainable Balanced Fund,,SDR Labelled,
SUTL Cazenove Sustainable Balanced Fund (Schroders),,SDR Labelled,
SUTL Cazenove Sustainable Growth Fund,,SDR Labelled,
SVS AllianceBernstein Sustainable Global Equity Fund,,SDR Labelled,
SVS AllianceBernstein Sustainable US Equity Fund,,SDR Labelled,
T. Rowe Price Global Impact Credit Fund,,SDR Labelled,
T. Rowe Price Global Impact Equity Fund,,SDR Labelled,
TrinityBridge Sustainable Balanced Portfolio Fund,,SDR Labelled,
US Solar Fund,Listed,,USF.L
VH Global Energy Infrastructure,Listed,SDR Labelled,ENRG.L
WS Guinness Sustainable Energy Fund,,SDR Labelled,
WS Montanaro Better World Fund,,SDR Labelled,